{
  "version": "v3",
  "week": 17,
  "title": "Week 17 - Advanced argumentation",
  "domain": "general_tech_balanced",
  "week_profile": {
    "phase": "Performance",
    "cefr_target": "B2",
    "domain_mix": {
      "general": 60,
      "tech": 40
    },
    "cognitive_load": "high",
    "central_task": "defender postura y objeciones"
  },
  "focus": {
    "grammar": [
      "Primary linguistic focus: argumentacion avanzada",
      "Explicit form focus before communication",
      "Weekly transfer of corrected forms into speaking"
    ],
    "functions": [
      "Core function: defender postura y objeciones",
      "Sustain conversation with follow-up and repair",
      "Switch between general and tech contexts without breakdown"
    ],
    "pronunciation": [
      "Intelligibility first: stress, rhythm, and endings",
      "Repair-friendly speech under pressure",
      "Chunk prosody for fluent delivery"
    ]
  },
  "book_modules": {
    "grammar": [
      "egiu_intermediate_02"
    ],
    "vocabulary": [
      "ows_intermediate_02",
      "eviu_intermediate_01"
    ],
    "pronunciation": [
      "epiu_intermediate_01"
    ],
    "reader": [
      "reader_penguin_b2"
    ],
    "theory": [
      "theory_hlal_transfer"
    ]
  },
  "assessment": {
    "type": "daily_progress",
    "checkpoint_week": false,
    "pass_criteria": [
      "Weekly KPI minima achieved",
      "Rubric trend stable or improving",
      "Metrics trend stable or improving",
      "Complete evidence for 7 sessions"
    ]
  },
  "adaptive_overrides": [
    "repair_success_boost",
    "error_density_precision_cycle",
    "turn_length_support",
    "pronunciation_intensive_week",
    "anti_fatigue_protocol",
    "difficulty_upgrade",
    "extension_risk_w05",
    "extension_auto_w10"
  ],
  "weekly_gate": {
    "description": "Week closes only with KPI compliance, evidence completeness, and adaptive review.",
    "checks": [
      "Speaking >= 480 min (target 540)",
      "Listening intensivo >= 180 min",
      "Reading activo >= 120 min",
      "Writing >= 4 outputs",
      "Accuracy drills >= 6",
      "Checklist completion >= 85%",
      "Evidence complete in tracking/daily"
    ]
  },
  "days": {
    "Mon": {
      "minutes": 120,
      "goal": "Launch week objective: argumentacion avanzada",
      "task_design": "Input -> Explicit instruction -> Guided practice -> Output1 -> Feedback -> Output2 -> Transfer",
      "blocks": [
        {
          "name": "Retrieval engine",
          "minutes": 15,
          "instructions": "Repaso D+1, D+3, D+7 con tarjetas y errores reales."
        },
        {
          "name": "Book module explicit lesson",
          "minutes": 20,
          "instructions": "Microleccion + 8 microdrills del modulo asignado."
        },
        {
          "name": "Guided listening",
          "minutes": 20,
          "instructions": "Tres pasadas: gist, detail, inference."
        },
        {
          "name": "Speaking task",
          "minutes": 35,
          "instructions": "Fluency -> Accuracy -> Repair bajo tiempo controlado."
        },
        {
          "name": "Pronunciation lab",
          "minutes": 10,
          "instructions": "Pares minimos, stress y shadowing de chunks."
        },
        {
          "name": "Writing transfer",
          "minutes": 20,
          "instructions": "Produccion guiada, correccion y reescritura parcial."
        }
      ],
      "sesame": {
        "prompt": "You are my strict speaking coach. Week 17 focus: argumentacion avanzada. Day goal: Launch week objective: argumentacion avanzada. Keep me speaking, avoid translation, and force self-correction after each round.",
        "rounds": [
          "Fluency round: sustained answer with minimal pauses",
          "Accuracy round: self-correct top errors",
          "Repair round: recover meaning under interruption"
        ]
      },
      "reading": {
        "task": "Read a graded text aligned to this week focus and extract reusable patterns.",
        "output": "3 key ideas + 8 reusable chunks"
      },
      "writing": {
        "task": "Write transfer output and rewrite after correction.",
        "genre": "daily transfer",
        "min_words": 140,
        "output": "final corrected version + chunk list"
      },
      "daily_exercises": [
        {
          "type": "retrieval_quiz",
          "instructions": "Recupera estructuras objetivo sin apoyo.",
          "output": "10 respuestas orales"
        },
        {
          "type": "error_rewrite",
          "instructions": "Corrige 10 errores propios y verbaliza patron.",
          "output": "10 pares error->correccion"
        },
        {
          "type": "guided_listening_sheet",
          "instructions": "Completa gist, detail e inference del audio.",
          "output": "Hoja de listening completa"
        },
        {
          "type": "chunk_extraction",
          "instructions": "Extrae 8 chunks reutilizables del input.",
          "output": "Lista de 8 chunks"
        },
        {
          "type": "roleplay_task",
          "instructions": "Completa roleplay con objetivo del dia.",
          "output": "Audio 3-5 min"
        },
        {
          "type": "repair_drill",
          "instructions": "Practica aclarar, parafrasear y recuperar.",
          "output": "5 reparaciones limpias"
        },
        {
          "type": "pron_shadow_task",
          "instructions": "Shadowing con ritmo y finales claros.",
          "output": "Audio 60-90 segundos"
        },
        {
          "type": "writing_transform_task",
          "instructions": "Escribe y reescribe salida del dia.",
          "output": "120-190 palabras"
        }
      ],
      "resource_pack": [
        {
          "id": "voa_learn_daily",
          "minutes": 15,
          "purpose": "retrieval and warm-up"
        },
        {
          "id": "esl_cyber_listen",
          "minutes": 20,
          "purpose": "guided listening"
        },
        {
          "id": "youglish_pron",
          "minutes": 35,
          "purpose": "speaking rounds"
        },
        {
          "id": "cambridge_dict",
          "minutes": 20,
          "purpose": "writing transfer"
        }
      ],
      "book_modules": [
        "egiu_intermediate_02",
        "ows_intermediate_02",
        "eviu_intermediate_01",
        "epiu_intermediate_01",
        "reader_penguin_b2",
        "theory_hlal_transfer"
      ],
      "deliverables": [
        "Speaking audio evidence",
        "Writing corrected output",
        "Metrics and rubric log",
        "Adaptive notes with next focus"
      ],
      "rubric": {
        "fluency": {
          "target": 2,
          "descriptor": "Sustained speech with functional pause control"
        },
        "accuracy": {
          "target": 2,
          "descriptor": "Grammar and word choice are reliable enough"
        },
        "interaction": {
          "target": 3,
          "descriptor": "Handles follow-up, challenge, and repair"
        },
        "pronunciation": {
          "target": 2,
          "descriptor": "Clear intelligibility under pressure"
        }
      },
      "metrics": {
        "error_density": "<= 6 errors per 100 words",
        "repair_success": ">= 80%",
        "turn_length": ">= 90 seconds",
        "comprehension_split": "gist >= 82% / detail >= 65%",
        "lexical_reuse": ">= 14 chunks"
      },
      "metrics_targets": {
        "error_density_max": 6,
        "repair_success_min": 80,
        "turn_length_min_seconds": 90,
        "gist_min": 82,
        "detail_min": 65,
        "lexical_reuse_min": 14,
        "pronunciation_score_min": 2.2
      },
      "adaptive_overrides": [
        "repair_success_boost",
        "error_density_precision_cycle",
        "turn_length_support",
        "pronunciation_intensive_week",
        "anti_fatigue_protocol",
        "difficulty_upgrade",
        "extension_risk_w05",
        "extension_auto_w10"
      ],
      "daily_gate": "Register baseline metrics and complete all artifacts."
    },
    "Tue": {
      "minutes": 120,
      "goal": "Accuracy + listening transfer",
      "task_design": "Input -> Explicit instruction -> Guided practice -> Output1 -> Feedback -> Output2 -> Transfer",
      "blocks": [
        {
          "name": "Retrieval engine",
          "minutes": 15,
          "instructions": "Repaso D+1, D+3, D+7 con tarjetas y errores reales."
        },
        {
          "name": "Book module explicit lesson",
          "minutes": 20,
          "instructions": "Microleccion + 8 microdrills del modulo asignado."
        },
        {
          "name": "Guided listening",
          "minutes": 20,
          "instructions": "Tres pasadas: gist, detail, inference."
        },
        {
          "name": "Speaking task",
          "minutes": 35,
          "instructions": "Fluency -> Accuracy -> Repair bajo tiempo controlado."
        },
        {
          "name": "Pronunciation lab",
          "minutes": 10,
          "instructions": "Pares minimos, stress y shadowing de chunks."
        },
        {
          "name": "Writing transfer",
          "minutes": 20,
          "instructions": "Produccion guiada, correccion y reescritura parcial."
        }
      ],
      "sesame": {
        "prompt": "You are my strict speaking coach. Week 17 focus: argumentacion avanzada. Day goal: Accuracy + listening transfer. Keep me speaking, avoid translation, and force self-correction after each round.",
        "rounds": [
          "Fluency round: sustained answer with minimal pauses",
          "Accuracy round: self-correct top errors",
          "Repair round: recover meaning under interruption"
        ]
      },
      "reading": {
        "task": "Read a graded text aligned to this week focus and extract reusable patterns.",
        "output": "3 key ideas + 8 reusable chunks"
      },
      "writing": {
        "task": "Write transfer output and rewrite after correction.",